{
  "schema_version": "0.3",
  "venue_name": "Bella Notte Trattoria",
  "venue_url": "https://bellanotte-demo.example.com",
  "last_updated": "2026-03-05",
  "effective_at": "2026-03-05",
  "default_policy": "deny_if_unspecified",
  "disclosure_required": {
    "enabled": true,
    "phrasing": "I am an AI assistant calling on behalf of a guest."
  },
  "allowed_channels": ["phone", "web"],
  "human_escalation_required": {
    "conditions": ["reservation_modification"]
  },
  "complaint_endpoint": "https://bellanotte-demo.example.com/agent-complaints",
  "party_size_policy": {
    "auto_book_max": 6,
    "human_review_above": 8,
    "large_party_channels": ["phone", "email"]
  }
}
