{
  "schema_version": "0.1",
  "venue_name": "Bella Notte Trattoria",
  "venue_url": "https://bellanotte-demo.example.com",
  "last_updated": "2026-03-05",
  "effective_at": "2026-03-05",
  "default_policy": "deny_if_unspecified",
  "disclosure_required": {
    "enabled": true,
    "phrasing": "I am an AI assistant calling on behalf of a guest."
  },
  "allowed_channels": ["phone", "web"],
  "human_escalation_required": {
    "conditions": ["reservation_modification"]
  },
  "party_size_policy": {
    "auto_book_max": 4
  },
  "complaint_endpoint": "https://bellanotte-demo.example.com/agent-complaints",
  "deposit_policy": {
    "required": true,
    "amount": 50,
    "currency": "USD",
    "refundable": false
  },
  "cancellation_policy": {
    "penalty_applies": true,
    "window_minutes": 1440,
    "penalty_amount": 50,
    "currency": "USD"
  },
  "no_show_policy": {
    "fee": 100,
    "currency": "USD",
    "grace_period_minutes": 15
  },
  "user_acknowledgment_requirements": ["deposit_policy", "cancellation_policy", "no_show_policy"]
}
