{
  "schema_version": "0.3",
  "venue_name": "Bella Notte Trattoria",
  "venue_url": "https://bellanotte-demo.example.com",
  "last_updated": "2026-03-09",
  "effective_at": "2026-03-09",
  "default_policy": "deny_if_unspecified",
  "venue_currency": "USD",
  "venue_timezone": "America/Chicago",
  "disclosure_required": {
    "enabled": true,
    "phrasing": "I am an AI assistant calling on behalf of a guest."
  },
  "allowed_channels": ["phone", "web"],
  "rate_limits": [
    {
      "action": "booking_request",
      "limit": 5,
      "window_value": 1,
      "window_unit": "hour",
      "counting_scope": "per_agent"
    }
  ],
  "human_escalation_required": {
    "conditions": ["reservation_modification"]
  },
  "party_size_policy": {
    "auto_book_max": 4
  },
  "deposit_policy": {
    "required": true,
    "amount": 25,
    "currency": "USD",
    "refundable": true
  },
  "cancellation_policy": {
    "penalty_applies": true,
    "window_minutes": 1440,
    "penalty_amount": 25,
    "currency": "USD"
  },
  "no_show_policy": {
    "fee": 50,
    "currency": "USD",
    "grace_period_minutes": 15
  },
  "booking_window": {
    "min_hours_ahead": 1,
    "max_days_ahead": 30
  },
  "user_acknowledgment_requirements": ["deposit_policy", "cancellation_policy", "no_show_policy"],
  "complaint_endpoint": "https://bellanotte-demo.example.com/agent-complaints"
}
