{
  "schema_version": "0.3",
  "venue_name": "Applies-To Test Bistro",
  "venue_url": "https://applies-to-test.example.com",
  "last_updated": "2026-03-14",
  "effective_at": "2026-03-14",
  "default_policy": "allow_if_unspecified",
  "disclosure_required": { "enabled": false },
  "allowed_channels": ["phone", "web"],
  "rate_limits": [
    {
      "action": "booking_request",
      "limit": 5,
      "window_value": 1,
      "window_unit": "hour",
      "applies_to": ["create_booking", "modify_booking"]
    },
    {
      "action": "inquiry",
      "limit": 10,
      "window_value": 1,
      "window_unit": "day"
    }
  ]
}
